post_id,post_url,username_or_userid,timestamp,date,time,total_reactions,total_comments,total_shares,post_text,video_view_count,profile_type,profile_name,profile_id,reaction_Like,reaction_Haha,reaction_Love,reaction_Care,reaction_Wow,reaction_Sad,reaction_Angry,account_name,account_type,account_category,account_website,account_followers,scrape_date
1043240064517907,https://www.facebook.com/1043240064517907,AWMemorial,2025-04-03 00:00:29,2025-04-03,1743638429,244,0,32,"Australian federal elections have taken place during peace time and times of conflict. Even two world wars could not stop Australians casting their ballots - whether at home or on the battlefield. 🗳️

📸 Take a look at these insightful photographs from the Memorial's collection:

1. Australian troops within half a mile of the Japanese front line, being watched by American colleagues, as they prepare to vote in the 1943 Federal election. AWM 015670

2. RAAF officers casting their vote in the 1943 election at Milne Bay, Papua. OG0037

3. Soldiers from the 21st Battalion waiting their turn to vote in the Australian Commonwealth Government election, while serving in the front line support trenches at Vaulx-Vraucourt, near Bullecourt. A00755

4. Members of the 7th Light Horse Regiment vote in the 1917 Federal Election at a desert outpost in the Weli Sheikh Nuran area, Palestine. P09606.003

5. Members of the Australian Army Nursing Service recording their vote in the 1943 federal election at a suburban polling booth in Melbourne, Victoria. AWM 139487",,User,Australian War Memorial,100064957681170,209,0,17,16,1,1,0,AWMemorial,· Museum,"Fairbairn Avenue, Canberra, ACT, Australia, Australian Capital Territory",+61 2 6243 4211,socialmedia@awm.gov.au,2025-04-08 13:01:58
1042365531272027,https://www.facebook.com/1042365531272027,AWMemorial,2025-04-01 23:00:36,2025-04-01,1743548436,36,2,0,"American paediatrician Dr Benjamin Spock is a well-known figure to parents of the 1940s, ‘50s and ‘60s. His 1946 text, “The Common Sense Book of Baby and Child Care” was an accepted authority on child rearing, in which he encouraged parents to “treat children with respect” and “see their children as individuals”.

During the 1960s and ‘70s, Dr Spock spoke out against the Vietnam War, highlighting its impact on children. He joined with civil rights leaders Coretta Scott King and Martin Luther King at anti-war demonstrations in the United States.

This poster advertised Dr Spock as a speaker at 1971 moratorium events in Sydney calling for an end to the Vietnam War. 

--
Image credit:
(maker unknown)
Doctor Spock in Sydney
printed in Sydney, 1971
halftone photoengraving on paper
50 x 38 cm
presented by Trans National Cooperative in 1979
ARTV00877",,User,Australian War Memorial,100064957681170,34,0,1,1,0,0,0,AWMemorial,· Museum,"Fairbairn Avenue, Canberra, ACT, Australia, Australian Capital Territory",+61 2 6243 4211,socialmedia@awm.gov.au,2025-04-08 13:01:58
1041738041334776,https://www.facebook.com/1041738041334776,AWMemorial,2025-04-01 04:00:18,2025-04-01,1743480018,1683,168,279,"This month marks 110 years since Australian and New Zealand forces landed at Gallipoli, where they faced fierce resistance from Ottoman Turkish defenders.

What was meant to be a decisive strike turned into an eight-month campaign of hardship, bravery, and loss.

By the end of 1915, the Allied forces withdrew, with the lives of more than 8,000 Australian soldiers lost. The campaign left a profound mark on Australia, shaping our national identity and cementing 25 April as a day of remembrance. 

On Anzac Day, we honour the courage and sacrifice of all Australians who have served in times of peace and war.

🔗 Learn more: https://brnw.ch/21wRHBj 

📸 Image: Australian 1st Divisional Signal Company troops being towed toward Anzac Cove, 1915. (AWM A02781)

#AnzacDay2025 #LestWeForget #Gallipoli",,User,Australian War Memorial,100064957681170,1201,1,55,367,5,52,2,AWMemorial,· Museum,"Fairbairn Avenue, Canberra, ACT, Australia, Australian Capital Territory",+61 2 6243 4211,socialmedia@awm.gov.au,2025-04-08 13:01:58
1046570554184858,https://www.facebook.com/1046570554184858,AWMemorial,2025-04-07 04:00:05,2025-04-07,1743998405,91,8,16,"🎖️ Calling all veterans 🎖️ 

Registrations to participate in the 2025 RSL ACT Branch Veterans’ March close in just one week, on Monday 14 April. 📝

Join us this Anzac Day on the Memorial’s new Parade Ground to commemorate all Australians who have served in times of peace and war.

Current and former serving Australian Defence Force, Commonwealth or Allied force veterans, and their relatives are eligible to participate.

🔗 Register now to take part: https://brnw.ch/21wRPbm

#AnzacDay2025",,User,Australian War Memorial,100064957681170,73,0,6,12,0,0,0,AWMemorial,· Museum,"Fairbairn Avenue, Canberra, ACT, Australia, Australian Capital Territory",+61 2 6243 4211,socialmedia@awm.gov.au,2025-04-08 13:01:58
1046425440866036,https://www.facebook.com/1046425440866036,AWMemorial,2025-04-06 23:00:55,2025-04-06,1743980455,209,4,19,"A female member of the RAF pauses on her motor cycle to enjoy a cup of tea, circa 1918. She still wears the insignia of the Royal Flying Corps (RFC) on the shoulder of her jacket. 🏍️

Accession number: H11949
#photooftheweek #myawm",,User,Australian War Memorial,100064957681170,167,0,22,20,0,0,0,AWMemorial,· Museum,"Fairbairn Avenue, Canberra, ACT, Australia, Australian Capital Territory",+61 2 6243 4211,socialmedia@awm.gov.au,2025-04-08 13:01:58
1045631820945398,https://www.facebook.com/1045631820945398,AWMemorial,2025-04-05 22:55:39,2025-04-05,1743893739,161,2,22,"Can you imagine receiving a message that signified a momentous event in living history? 💬

That is exactly what happened to a team of RAAF personnel at North-West Area Headquarters in Darwin, on August 14th, 1945. The Teleprinter Operator, Telegraphist and like personnel were on duty that fateful day when they received an emergency teleprinter signal issuing instructions to:

""Cancel all operations against the enemy forthwith including missions now airborne"".

These few words essentially heralded the closing of the Second World War, the Japanese accepting the Allied demand for unconditional surrender that very day.

This teleprinter signal was donated to the Australian War Memorial by one of the RAAF personnel who was there when the signal was received. It is one of several copies which were usually discarded once the top copy was delivered to the Operations Room.

It was certainly the message of a lifetime.

Accession number: RC06417

Image: Lance-Corporal B. Sutton, Teleprinter Operator (1), at 17 Lines Of Communication Signals. Darwin NT, 6 November 1944. AWM 082609",,User,Australian War Memorial,100064957681170,134,0,20,5,2,0,0,AWMemorial,· Museum,"Fairbairn Avenue, Canberra, ACT, Australia, Australian Capital Territory",+61 2 6243 4211,socialmedia@awm.gov.au,2025-04-08 13:01:58
1044969417678305,https://www.facebook.com/1044969417678305,AWMemorial,2025-04-05 03:01:02,2025-04-05,1743822062,510,15,104,"Today is the 50th anniversary of Operation Baby Lift.

On 4-5 April 1975, Australia and the United States launched a daring mission that lifted over 3,000 orphaned and displaced children from Saigon, Vietnam. 

Over 200 children were evacuated to Australia, travelling in two RAAF C-130 Hercules from Saigon to Bangkok. They were met by a Qantas airliner which brought the children to Australia where they were immediately taken into hospital care.

Many of the children were extremely sick upon their arrival and tragically some did not survive. For those who did, their new lives with adoptive families in Australia would be mixed. Dominic Golding shares his story.

Watch the full video: https://brnw.ch/21wRNKo",8467.0,User,Australian War Memorial,100064957681170,360,0,31,114,3,1,1,AWMemorial,· Museum,"Fairbairn Avenue, Canberra, ACT, Australia, Australian Capital Territory",+61 2 6243 4211,socialmedia@awm.gov.au,2025-04-08 13:01:58
1044205651088015,https://www.facebook.com/1044205651088015,AWMemorial,2025-04-04 04:00:14,2025-04-04,1743739214,107,0,11,"Taxidermy is historically important to museum collections and the Australian War Memorial has several different examples. So why does the Australian War Memorial have a stuffed cockatoo?

When this sulphur crested cockatoo died in 1925, he was 47 years old, and was owned by one of the wealthiest women in Victoria and noted philanthropist Mrs Anne Fraser Bon. Mrs Bon had donated an ambulance to the Belgian Army during the war and from 1919 until her death in 1936, she reportedly gave a Christmas gift of twenty pounds to every Victorian soldier blinded in the war.

Mrs Bon loaned ‘Cocky’ to No 1 Rest Home, Wirth’s Park, Melbourne, to entertain rehabilitating First World War soldiers. Here, the Australian soldiers delighted in expanding Cocky’s extensive vocabulary, including two of his more popular phrases “Show your pass!” or “Go on, you’re a German!”, and a string of expletives that soon sent ‘Cocky’ home to Mrs Bon.

When ‘Cocky’ died, Mrs Bon sent him immediately to a taxidermist to have him displayed at the newly proposed Australian War Memorial. So what on first appearances is a stuffed bird, has ensured a rich story of rehabilitation and philanthropy has been preserved. 

Accession number: RELAWM08024
#objectoftheweek #AWMobjects #myawm #AWMemorial",,User,Australian War Memorial,100064957681170,89,0,16,2,0,0,0,AWMemorial,· Museum,"Fairbairn Avenue, Canberra, ACT, Australia, Australian Capital Territory",+61 2 6243 4211,socialmedia@awm.gov.au,2025-04-08 13:01:58
1044060207769226,https://www.facebook.com/1044060207769226,AWMemorial,2025-04-03 23:14:07,2025-04-03,1743722047,267,8,39,"WATCH: F/A-18 Classic Hornet, C-130 Hercules and Bushmaster make their final journey to Anzac Hall. ✈️✨

The largest relocation of military technology in the Memorial's history is under way - just weeks ahead of Anzac Day.

The Hornet, A21-022, retired in 2020 after more than 6,000 flying hours, and was the first RAAF fighter to drop bombs in combat since the Korean War, taking part in patrol and combat missions over Iraq and Syria.

The C-130 Hercules, with its deep, resonant hum, has carried Australians out of crisis zones, flown life-saving aid into disaster-stricken regions, and borne the weight of returning Australia's fallen home with dignity.

Finally, battle-damaged Bushmaster Protected Mobility Vehicle 'Debby' is a rugged, battle-hardened guardian that protected Australian troops in Iraq and Afghanistan from IEDs and ambushes.",6121.0,User,Australian War Memorial,100064957681170,227,0,32,4,4,0,0,AWMemorial,· Museum,"Fairbairn Avenue, Canberra, ACT, Australia, Australian Capital Territory",+61 2 6243 4211,socialmedia@awm.gov.au,2025-04-08 13:01:58
1043240064517907,https://www.facebook.com/1043240064517907,AWMemorial,2025-04-03 00:00:29,2025-04-03,1743638429,244,0,32,"Australian federal elections have taken place during peace time and times of conflict. Even two world wars could not stop Australians casting their ballots - whether at home or on the battlefield. 🗳️

📸 Take a look at these insightful photographs from the Memorial's collection:

1. Australian troops within half a mile of the Japanese front line, being watched by American colleagues, as they prepare to vote in the 1943 Federal election. AWM 015670

2. RAAF officers casting their vote in the 1943 election at Milne Bay, Papua. OG0037

3. Soldiers from the 21st Battalion waiting their turn to vote in the Australian Commonwealth Government election, while serving in the front line support trenches at Vaulx-Vraucourt, near Bullecourt. A00755

4. Members of the 7th Light Horse Regiment vote in the 1917 Federal Election at a desert outpost in the Weli Sheikh Nuran area, Palestine. P09606.003

5. Members of the Australian Army Nursing Service recording their vote in the 1943 federal election at a suburban polling booth in Melbourne, Victoria. AWM 139487",,User,Australian War Memorial,100064957681170,209,0,17,16,1,1,0,AWMemorial,· Museum,"Fairbairn Avenue, Canberra, ACT, Australia, Australian Capital Territory",+61 2 6243 4211,socialmedia@awm.gov.au,2025-04-08 13:01:58
1042365531272027,https://www.facebook.com/1042365531272027,AWMemorial,2025-04-01 23:00:36,2025-04-01,1743548436,36,2,0,"American paediatrician Dr Benjamin Spock is a well-known figure to parents of the 1940s, ‘50s and ‘60s. His 1946 text, “The Common Sense Book of Baby and Child Care” was an accepted authority on child rearing, in which he encouraged parents to “treat children with respect” and “see their children as individuals”.

During the 1960s and ‘70s, Dr Spock spoke out against the Vietnam War, highlighting its impact on children. He joined with civil rights leaders Coretta Scott King and Martin Luther King at anti-war demonstrations in the United States.

This poster advertised Dr Spock as a speaker at 1971 moratorium events in Sydney calling for an end to the Vietnam War. 

--
Image credit:
(maker unknown)
Doctor Spock in Sydney
printed in Sydney, 1971
halftone photoengraving on paper
50 x 38 cm
presented by Trans National Cooperative in 1979
ARTV00877",,User,Australian War Memorial,100064957681170,34,0,1,1,0,0,0,AWMemorial,· Museum,"Fairbairn Avenue, Canberra, ACT, Australia, Australian Capital Territory",+61 2 6243 4211,socialmedia@awm.gov.au,2025-04-08 13:01:58
1041738041334776,https://www.facebook.com/1041738041334776,AWMemorial,2025-04-01 04:00:18,2025-04-01,1743480018,1683,168,279,"This month marks 110 years since Australian and New Zealand forces landed at Gallipoli, where they faced fierce resistance from Ottoman Turkish defenders.

What was meant to be a decisive strike turned into an eight-month campaign of hardship, bravery, and loss.

By the end of 1915, the Allied forces withdrew, with the lives of more than 8,000 Australian soldiers lost. The campaign left a profound mark on Australia, shaping our national identity and cementing 25 April as a day of remembrance. 

On Anzac Day, we honour the courage and sacrifice of all Australians who have served in times of peace and war.

🔗 Learn more: https://brnw.ch/21wRHBj 

📸 Image: Australian 1st Divisional Signal Company troops being towed toward Anzac Cove, 1915. (AWM A02781)

#AnzacDay2025 #LestWeForget #Gallipoli",,User,Australian War Memorial,100064957681170,1201,1,55,367,5,52,2,AWMemorial,· Museum,"Fairbairn Avenue, Canberra, ACT, Australia, Australian Capital Territory",+61 2 6243 4211,socialmedia@awm.gov.au,2025-04-08 13:01:58
1041560781352502,https://www.facebook.com/1041560781352502,AWMemorial,2025-03-31 22:01:11,2025-03-31,1743458471,301,3,24,"Whether it's on April 1st, or any other day of the year, we know that Aussies love to have a laugh. 

For many, having a down-to-earth and jovial attitude is simply part of what it means to be Australian; using humour to stay humble in times of triumph, and lightening the mood in times of suffering. 

Ever since the ANZACs landed on Gallipoli, Australian troops have been known for their humorous outlook and light-hearted spirit, even when facing the darkest of days. 

Good luck to all the pranksters, jokesters and larrikins who are keeping their spirit alive today. 

---
Photos:  
- Private Charles Leo Gossage lies in wait with a snowball (1RAR) Korea, 31 January 1955, by Donald Albert Meldrum.
- Australians exchange hats with Malaysian children, Malaya, c September 1941, by Melmer Frank Nichols.
- Private D Hayward 2/1st Convalescent Depot has a laugh, British Mandate of Palestine, 16 August 1940, by Damien Peter Parer.
- Private Ray Mitchell and Private Brian McNamara joke with members of the Third All Queensland Concert Party in Saigon, Vietnam, November 1968, by Richard William Crothers.",,User,Australian War Memorial,100064957681170,247,1,22,31,0,0,0,AWMemorial,· Museum,"Fairbairn Avenue, Canberra, ACT, Australia, Australian Capital Territory",+61 2 6243 4211,socialmedia@awm.gov.au,2025-04-08 13:01:58
1040783148096932,https://www.facebook.com/1040783148096932,AWMemorial,2025-03-30 23:00:15,2025-03-30,1743375615,408,19,31,"This image of Sister Bessie Pocock in Mena, Egypt, circa 1915, captures a moment in her remarkable nursing career.

Serving in both the Boer War and First World War, she cared for soldiers on the frontlines, later earning the Associate Royal Red Cross.

After the war, Pocock returned to Australia where she founded a private hospital in Chatswood, NSW and remained an active member of nursing associations until her passing in 1946.

Accession number: P01840.010
#photooftheweek #myawm",,User,Australian War Memorial,100064957681170,322,0,35,46,5,0,0,AWMemorial,· Museum,"Fairbairn Avenue, Canberra, ACT, Australia, Australian Capital Territory",+61 2 6243 4211,socialmedia@awm.gov.au,2025-04-08 13:01:58
1040120568163190,https://www.facebook.com/1040120568163190,AWMemorial,2025-03-30 03:00:17,2025-03-30,1743303617,554,17,19,"More than 100 years after the battle of Morlancourt, the mud-encrusted uniform and kit worn by Private George James Giles in the battle is one of the Memorial’s most treasured collection items.

Displayed in the First World War gallery, the uniform has come to symbolise the Australian digger to generations of visitors. Collected by Charles Bean in July 1918, it has been on display almost continuously since the Memorial opened in 1941.

Giles’ story is reflective of many who served during the First World War. Enlisting in May 1916, he served on the Western Front for most of the war. At Vauvillers, east of Villers-Bretonneux, Giles was recommended for a Military Medal for ""conspicuous gallantry and devotion to duty.""

Earlier this month, the Memorial was very proud to welcome four generations Private Giles' family. The family have donated his service medals to the Memorial's collection, which will go on display next to his uniform in the future.  

Read more about Private Gile's lasting legacy: https://brnw.ch/21wRFmM

Images:
- Front view of two diggers of the 5th Division, PTE Giles of 29th Battalion (Left) and Pte John Wallace Anderton of 32nd Battalion (Right) AWM E02818
- The Giles family in the First World War gallery with PTE Giles' service medals, 13 March, AWM25.PR.024",,User,Australian War Memorial,100064957681170,439,0,19,92,2,2,0,AWMemorial,· Museum,"Fairbairn Avenue, Canberra, ACT, Australia, Australian Capital Territory",+61 2 6243 4211,socialmedia@awm.gov.au,2025-04-08 13:01:58
1039455181563062,https://www.facebook.com/1039455181563062,AWMemorial,2025-03-29 06:00:06,2025-03-29,1743228006,163,0,14,"On Anzac Day, Friday 25 April, the Memorial welcomes the public to commemorate the 110th anniversary of the Gallipoli landings, and pay tribute to all Australians who have served in times of peace and war.

The commemorative program includes:
🌅 Dawn Service, 5.30 am
☀️ ATSIVSA Commemorative Ceremony, 7.30 am
🎖️ National Commemorative Service including RSL ACT Branch Veterans’ March, 9.30 am
🎺 Last Post Ceremony, 4.30 pm

Join us as we reflect, remember, and honour those who have served.

🔗 More details: https://brnw.ch/21wREBM",,User,Australian War Memorial,100064957681170,110,0,19,34,0,0,0,AWMemorial,· Museum,"Fairbairn Avenue, Canberra, ACT, Australia, Australian Capital Territory",+61 2 6243 4211,socialmedia@awm.gov.au,2025-04-08 13:01:58
1039398411568739,https://www.facebook.com/1039398411568739,AWMemorial,2025-03-29 04:00:09,2025-03-29,1743220809,186,10,8,"On this day 140 years ago, the New South Wales Contingent arrived in Sudan.

This vibrant artwork depicts the Contingent's arrival at Suakin in Sudan, with the men arriving wearing red tunics. The British issued the troops with khaki uniforms on their first day so that they would not be stand out so much on the battlefield.

The second image showcases examples of these early uniforms, including the beige field service jacket worn by Private Arthur Barrett (Service Number: 123). These pieces are among the oldest uniforms in the Memorial’s collection, with the field service jacket belonging to the oldest complete uniform in the Memorial's collection.

The contingent set sail from Sydney on 3 March 1885 amid much public fanfare, generated in part by the holiday declared to farewell the troops. The send-off was described as the most festive occasion in the colony's history.

It was generally agreed at the time that, no matter how small the military significance of the Australian contribution to the War in Sudan, it marked an important stage in the development of colonial self-confidence and was proof of the enduring link with Britain.

--

Artwork: Beckmann Bros, London, 'Landing of the Australian contingent at Suakin', 1885, hand-coloured lithograph on paper, 42.6 x 54.8 cm. ART14435

Objects: Other Rank's scarlet tunic, REL/18862.001; Private A C Barrett's field service jacket, AWM2020.419.1",,User,Australian War Memorial,100064957681170,165,0,9,11,1,0,0,AWMemorial,· Museum,"Fairbairn Avenue, Canberra, ACT, Australia, Australian Capital Territory",+61 2 6243 4211,socialmedia@awm.gov.au,2025-04-08 13:01:58
1038446774997236,https://www.facebook.com/1038446774997236,AWMemorial,2025-03-27 22:00:33,2025-03-27,1743112833,146,1,3,"During the Second World War the skies over Europe were a perilous place. Crews of airmen would fly their aircraft into a carnage few can fathom.

Facing high casualty rates and extreme conditions, aircrews would often employ lucky charms such as this crochet doll to help cope with the incredible stress of operations.

A stalwart ally in the face of the enemy, 'Myrtle the Turtle' was attached to the instrument panel of Short Stirling heavy bomber LJ 514 'B for Beer' flown by a mixed Australian and British aircrew.

'B for Beer' participated in at least 70 operations of varying type. Stirling’s were initially used for strategic bombing, but were later deployed in ‘Mandrel’ electronic deception operations in which they deployed ‘window’, strips of foil used to spoof German radar.

‘Myrtle’ proved lucky for Flight Lieutenant Lawrence 'Lawrie' McKenzie, who was a bomb aimer aboard ‘B for Beer’ during many of its missions. McKenzie survived the war and brought ‘Myrtle’ back to Australia, later donating it to the Australian War Memorial.

Accession number: REL/18731

#objectoftheweek #AWMobjects #myawm #AWMemorial

Images:
- The nose art for ‘B for Beer’ featuring a bear holding a beer bottle, sitting astride a bomb. Next to this is a series of beer mugs, each denoting a mission the aircraft completed, c.1943. Photographer unknown. P01238.001

- Crew of Stirling bomber ‘B for Beer’ of No.199 Squadron RAF, Lakenheath, Suffolk, England, c.1943. Photographer unknown. P01238.004

- The Stirling bomber ‘B for Beer’ in flight, c.1943. Photographer unknown. P01238.003",,User,Australian War Memorial,100064957681170,125,0,8,13,0,0,0,AWMemorial,· Museum,"Fairbairn Avenue, Canberra, ACT, Australia, Australian Capital Territory",+61 2 6243 4211,socialmedia@awm.gov.au,2025-04-08 13:01:58
1037701305071783,https://www.facebook.com/1037701305071783,AWMemorial,2025-03-26 22:00:50,2025-03-26,1743026450,354,8,13,"Two-year-old Shirley Elizabeth Haines’ world changed after her father enlisted for service in 1942. For the next three years her father was far from home, serving with the Royal Australian Air Force.

Murray Haines left Australia on Christmas Day 1942 with No. 30 Squadron, bound for Port Moresby in the Territory of Papua. He did not return until March 1944, and then on 11 May 1945, shortly before Shirley’s sixth birthday, he again deployed overseas, this time with No. 1 Squadron to Malaya and Indonesia, where he remained until October 1945.

During his time away from home, Haines wrote letters which presented his wartime experiences in a way intended to fill his daughter’s imagination with excitement and wonder.

Read Haines' letters in our latest article: https://brnw.ch/21wRBf0

Images:
- Portrait of Flight Lieutenant Murray David Haines, c. 1942­–1945. (Photograph courtesy of his daughter, Elizabeth)
- Drawing of an elephant. AWM2023.738.1
- Picture of a boat made of “kisses”. AWM2023.738.1",,User,Australian War Memorial,100064957681170,248,0,33,71,1,1,0,AWMemorial,· Museum,"Fairbairn Avenue, Canberra, ACT, Australia, Australian Capital Territory",+61 2 6243 4211,socialmedia@awm.gov.au,2025-04-08 13:01:58
