post_id,post_url,username_or_userid,timestamp,date,time,total_reactions,total_comments,total_shares,post_text,video_view_count,profile_type,profile_name,profile_id,reaction_Like,reaction_Haha,reaction_Love,reaction_Care,reaction_Wow,reaction_Sad,reaction_Angry,account_name,account_type,account_category,account_website,account_followers,scrape_date
998067299035184,https://www.facebook.com/998067299035184,AWMemorial,2025-01-30 23:00:20,2025-01-30,1738278020,96,1,5,"This artist’s palette was used by Official War Artist Peter Churcher during his deployments to the Middle East and Indian Ocean in 2002.

Continuing a tradition extending back to the First World War, Churcher was commissioned by the Australian War Memorial to record images of Australian service personnel as part of Australia's involvement in the International Coalition against Terrorism. 

Stationed in the Persian Gulf, Churcher painted and sketched sailors aboard HMAS Kanimbla and Adelaide as they undertook their duties, daily operations and candid moments. 

After leaving the Middle East, Churcher, travelled to the island of Diego Garcia in the Indian Ocean. The island hosts a UK/US military base where the RAAF was based supporting operations in the Middle East.

Churcher depicted the environment, life on base, logistics and personnel, as well as American and Australian aircraft on the ‘flight line’ being readied, or returning from operations in the Middle East. His mixture of subjects highlights the human experience in a modern war, readiness, action and rest. 

Accession number: REL30341

---

Artworks: 
- Peter Churcher, 2002, 'Hornet on flightline at night, Diego Garcia', oil on hardboard. ART91764
- Peter Churcher, 2002, 'The RBS-70 afternoon watch, HMAS Kanimbla', oil on hardboard. ART91761
- Peter Churcher, 2002, Sleeping guy in ""Helo"" (helicopter), HMAS Kanimbla, oil on hardboard. ART91752 *

*Now on display in Critical Witness: Official war artists after 1999, Level 1.

#objectoftheweek #AWMobjects #myawm #AWMemorial",,User,Australian War Memorial,100064957681170,91,0,1,3,1,0,0,AWMemorial,· Museum,"Fairbairn Avenue, Canberra, ACT, Australia, Australian Capital Territory",+61 2 6243 4211,socialmedia@awm.gov.au,2025-04-08 13:01:58
997494342425813,https://www.facebook.com/997494342425813,AWMemorial,2025-01-30 02:00:27,2025-01-30,1738202427,216,4,16,"Lance Corporal John Anthony 'Tony' Parmenter, a Kokotha/Wirangu man, joined the Australian Army in July 1966. He served in Vietnam with the 1st Field Squadron, Royal Australian Engineers in 1967. 

As part of the online exhibition 'VIETNAM - ONE IN, ALL IN', Mirning/Antikirinjara man Beaver Lennon has shared Tony's story through his artwork titled 'Indigenous Return, Vietnam Veteran'. ""My message about honouring the heroes of Vietnam, and Tony in particular … I feel proud to be part of VIETNAM – ONE IN, ALL IN, and privileged to share and honour Tony’s service and story.""

VIETNAM – ONE IN, ALL IN shares untold stories of Aboriginal Vietnam Veterans from South Australia. The exhibition was supported by Aboriginal Veterans SA, the Government of South Australia and SA Statewide Indigenous Community Arts Development Project.

Explore the full exhibition online: https://brnw.ch/21wQln4

---
Colleen Strangways, Lance Corporal John Anthony ‘Tony’ Parmenter (Ret'd), 2019. AWM2023.730.1.1

Beaver Lennon, Mirning/Antikirinjara peoples, Indigenous Return, Vietnam Veteran, 2019, impasto and acrylic on canvas, 81 x 136cm, AWM2023.466.1. Photo: Chris Herzfeld",,User,Australian War Memorial,100064957681170,169,0,18,28,0,1,0,AWMemorial,· Museum,"Fairbairn Avenue, Canberra, ACT, Australia, Australian Capital Territory",+61 2 6243 4211,socialmedia@awm.gov.au,2025-04-08 13:01:58
996753155833265,https://www.facebook.com/996753155833265,AWMemorial,2025-01-29 00:00:09,2025-01-29,1738108809,314,15,18,"Soldiers from 1RAR (1st Battalion, The Royal Australian Regiment) oversee food distribution in the village of Sahmandeera, 20 January 1993. Identified are (left to right): Corporal Dean Caple and Private Matthew Dyer, both of 9 Platoon, Charlie Company. They were serving with the Australian contingent to the Unified Task Force in Somalia (UNITAF).

Accession Number: MSU/93/0025/33
Photographer: T. R. Dex

#photooftheweek #myawm #somalia",,User,Australian War Memorial,100064957681170,271,0,13,27,1,2,0,AWMemorial,· Museum,"Fairbairn Avenue, Canberra, ACT, Australia, Australian Capital Territory",+61 2 6243 4211,socialmedia@awm.gov.au,2025-04-08 13:01:58
995346729307241,https://www.facebook.com/995346729307241,AWMemorial,2025-01-26 23:00:24,2025-01-26,1737932424,675,58,173,"Today we commemorate the 80th Anniversary of the Liberation of Auschwitz-Birkenau Concentration Camp & International Holocaust Remembrance Day.

The Holocaust reveals the extremes of humanity’s capacity for evil, as well as its spirit of endurance and survival. The Holocaust is represented at the Memorial through the experiences of survivors who made new lives in post-war Australia, as well as Australians who witnessed the horrific aftermath of concentration camps.

Official war artist Alan Moore accompanied British troops as they liberated the Bergen-Belsen concentration camp in Germany. Moore attempted to represent the truth of what he witnessed in his drawings and paintings. He said:

""The day that I entered Belsen I didn’t expect anything like it. I forgot about doing anything that the army told me that I had to do … I wanted to try and put everything down as well as I could … drawing madly all the time. I wanted to show what it was, what was going on.""

Alan Moore artwork is displayed alongside the stories of Australian holocaust survivors in the Second World War galleries at the Memorial.

Artwork: Alan Moore (1914–2015), 'Blind man in Belsen', painted in Melbourne, 1947, oil on canvas. ART27620",,User,Australian War Memorial,100064957681170,233,2,10,232,0,198,0,AWMemorial,· Museum,"Fairbairn Avenue, Canberra, ACT, Australia, Australian Capital Territory",+61 2 6243 4211,socialmedia@awm.gov.au,2025-04-08 13:01:58
994699662705281,https://www.facebook.com/994699662705281,AWMemorial,2025-01-26 02:00:04,2025-01-26,1737856804,880,69,184,"For this Australia Day, we are sharing the story behind one of the oldest Australian flags in the Memorial's collection. 🇦🇺

This Australian flag was presented to Major John Carr Ewen by the residents of Bellingen - the town where he farmed after emigrating to Australia - when he enlisted in the First World War. He carried the flag as a reminder of Australia throughout the war.

As Australian flags were not issued to units serving overseas, Ewen's flag was often called into service for various ceremonies in France. His mother subsequently embroidered the names and dates on the flag.

Accession number: REL/01258",,User,Australian War Memorial,100064957681170,644,0,191,35,10,0,0,AWMemorial,· Museum,"Fairbairn Avenue, Canberra, ACT, Australia, Australian Capital Territory",+61 2 6243 4211,socialmedia@awm.gov.au,2025-04-08 13:01:58
994007869441127,https://www.facebook.com/994007869441127,AWMemorial,2025-01-25 03:00:34,2025-01-25,1737774034,370,32,43,"Private Lionel John 'Bomber' Terry, 3rd Battalion, The Royal Australian Regiment (3RAR) stands in a trench outside a bunker before heading out on a patrol. A miner prior to enlistment, Pte Terry commenced his service in Korea on 4 July 1952. 

On the night of 24-25 January 1953, Pte Terry was a wireless operator on a patrol which moved from Hill 355 into enemy territory to raid a Chinese standing patrol and capture a prisoner.

During the battle which ensued, Pte Terry was wounded but later led a charge against an attack from the rear. He was last seen fighting a group to 20 Chinese soldiers.

Pte Terry's body was never recovered and he is regarded as missing presumed dead on 25 January 1953. He was aged 22.

In June 1955 he was posthumously Mentioned in Despatches. The citation read: ""By his complete devotion to duty and personal sacrifice Pte Terry made it possible for his patrol to break cleanly from an overwhelmingly superior force and extricate itself with its wounded.""",,User,Australian War Memorial,100064957681170,220,0,10,84,2,54,0,AWMemorial,· Museum,"Fairbairn Avenue, Canberra, ACT, Australia, Australian Capital Territory",+61 2 6243 4211,socialmedia@awm.gov.au,2025-04-08 13:01:58
993854986123082,https://www.facebook.com/993854986123082,AWMemorial,2025-01-24 21:01:08,2025-01-24,1737752468,125,17,25,"Are you planning to visit the Memorial soon? 

Follow these 5 handy tips to get the most from your visit. From joining a free guided tour, to attending the daily Last Post Ceremony, our friendly team is ready to help you have special visit. 

The Memorial is open from 10am each day. Tickets are no longer required for entry. 

Find out more and plan your visit: https://brnw.ch/visit",,User,Australian War Memorial,100064957681170,104,0,14,7,0,0,0,AWMemorial,· Museum,"Fairbairn Avenue, Canberra, ACT, Australia, Australian Capital Territory",+61 2 6243 4211,socialmedia@awm.gov.au,2025-04-08 13:01:58
993263842848863,https://www.facebook.com/993263842848863,AWMemorial,2025-01-24 02:01:22,2025-01-24,1737684082,60,0,4,"The Memorial is excited to announce that our new store is now open!

🎁 Explore our new range of apparel and giftware - designed exclusively for the Memorial Shop: https://brnw.ch/21wQd7b

🛒 Shop online or visit us in-store, the Memorial Shop is located in the new Main Entrance of the Australian War Memorial, open daily 10am - 4.30pm.

---

📺 Stay tuned - New products arriving each month. 

📧 Subscribe to our mailing list to stay updated about new releases and upcoming commemorative or seasonal sales events.

🏷️ Sign up and get 10% off your first order: https://brnw.ch/21wQd7a",877.0,User,Australian War Memorial,100064957681170,52,0,5,2,1,0,0,AWMemorial,· Museum,"Fairbairn Avenue, Canberra, ACT, Australia, Australian Capital Territory",+61 2 6243 4211,socialmedia@awm.gov.au,2025-04-08 13:01:58
993170142858233,https://www.facebook.com/993170142858233,AWMemorial,2025-01-23 22:01:19,2025-01-23,1737669679,123,5,13,"While much has been written about Simpson’s donkey during the First World War, the role of his close cousin – the mule – has not been given as much attention. 🫏

Mules were extremely useful modes of transport on the Western Front. They were ridden, used as pack transport, and hauled heavy wagons. They were particularly useful in transporting supplies within the light railway systems of the First World War. 🚂

Read our latest article to learn about the role of mules: https://brnw.ch/21wQd0u

---

Image: Two mules carrying field gun ammunition across muddy country unsuitable for normal transport. (Accession number: H08966)",,User,Australian War Memorial,100064957681170,109,0,3,10,0,1,0,AWMemorial,· Museum,"Fairbairn Avenue, Canberra, ACT, Australia, Australian Capital Territory",+61 2 6243 4211,socialmedia@awm.gov.au,2025-04-08 13:01:58
992532282922019,https://www.facebook.com/992532282922019,AWMemorial,2025-01-22 23:03:31,2025-01-22,1737587011,295,12,44,"This captivating trench art clock was crafted by Sapper Stanley Keith Pearl, a Tasmanian soldier who served with 5 Field Company Engineers during the First World War. ⏰

Can you guess what salvaged materials were used to create it?

▶️ Watch to discover the incredible ingenuity behind its construction.

Accession number: RELAWM14155

#ObjectOfTheWeek",4790.0,User,Australian War Memorial,100064957681170,255,0,22,8,10,0,0,AWMemorial,· Museum,"Fairbairn Avenue, Canberra, ACT, Australia, Australian Capital Territory",+61 2 6243 4211,socialmedia@awm.gov.au,2025-04-08 13:01:58
992050419636872,https://www.facebook.com/992050419636872,AWMemorial,2025-01-22 06:02:54,2025-01-22,1737525774,87,0,4,"What does an Australian official war artist do? 🎨 Art Curator, Elise Routledge introduces our compelling exhibition ‘Critical Witness: Official war artists after 1999’.

Presenting the work of 14 contemporary official war artists, Critical Witness offers insights into the experiences of our service personnel and the complex conflicts of our times.

Now exhibiting on Level 1 of the Australian War Memorial.

Learn more: https://www.awm.gov.au/visit/exhibitions/critical-witness",1251.0,User,Australian War Memorial,100064957681170,86,0,0,1,0,0,0,AWMemorial,· Museum,"Fairbairn Avenue, Canberra, ACT, Australia, Australian Capital Territory",+61 2 6243 4211,socialmedia@awm.gov.au,2025-04-08 13:01:58
991165323058715,https://www.facebook.com/991165323058715,AWMemorial,2025-01-21 00:00:08,2025-01-21,1737417608,85,0,6,"Royal Australian Army nurses Private (Pte) Gladys Devine and Pte Rona Cooper admiring Japanese artworks and architecture in Tokyo whilst on leave from serving at the British Commonwealth General Hospital in Kure.

Nurses stationed at Kure tended to wounded soldiers during the Korean War. Pte Devine and Pte Cooper are being escorted by Corporal Andy Ingram.

Accession Number: HOBJ5736
Photographer: Phillip Oliver Hobson

#photooftheweek #myawm #koreanwar #japan",,User,Australian War Memorial,100064957681170,72,0,4,9,0,0,0,AWMemorial,· Museum,"Fairbairn Avenue, Canberra, ACT, Australia, Australian Capital Territory",+61 2 6243 4211,socialmedia@awm.gov.au,2025-04-08 13:01:58
990529153122332,https://www.facebook.com/990529153122332,AWMemorial,2025-01-20 04:00:16,2025-01-20,1737345616,108,1,15,"Visitors to the Second World War Galleries can now explore twenty new and unique objects from the Memorial's Research Centre collections. 🔍✨

These original items include poignant letters from prisoners of war, a rare flyer on the Anderson air raid shelter, and a unique Changi concert program. ✉️🎶

Learn about all the new additions: https://brnw.ch/21wQ7gV",,User,Australian War Memorial,100064957681170,90,0,4,13,1,0,0,AWMemorial,· Museum,"Fairbairn Avenue, Canberra, ACT, Australia, Australian Capital Territory",+61 2 6243 4211,socialmedia@awm.gov.au,2025-04-08 13:01:58
989659373209310,https://www.facebook.com/989659373209310,AWMemorial,2025-01-18 23:00:27,2025-01-18,1737241227,69,1,9,"As the Australian Open enters its final week, let's take a moment to appreciate the enduring spirit of tennis in Australian culture. 🎾

Even amidst the turmoil of the Second World War, our service personnel found solace on the court. Whether it was a casual game during recreational time or representing Australia on the international stage, tennis remained a beloved pastime.

Take a look at these images from the National Collection, showcasing service personnel from a variety of eras. 📸

---
1. London, England. 30 June 1945. Flight Sergeant O. W. Sidwell RAAF playing against Captain A. Henderson US Army Air Force in the inter-services lawn tennis match, British Empire versus USA at Wimbledon. SUK14551 

2. Captain A. Henderson (left) congratulates Flight Sergeant O. W. Sidwell on winning the singles match. SUK14548

3. Toorak, Victoria. 27 March 1944. Trainees of the Australian Women's Army Service Officers Training School waiting to go on to the tennis court for a doubles match during their recreation sports period. AWM 065150

4. July 1952. Members of 78 Fighter Wing RAAF playing deck tennis aboard the SS Asturias. MALTA0063

5. June 1919. Captain P. O'Hara Wood of Australia, playing in the London Championship Tennis Tournament at Queen's Club, Baron's Court. D00776",,User,Australian War Memorial,100064957681170,66,0,2,1,0,0,0,AWMemorial,· Museum,"Fairbairn Avenue, Canberra, ACT, Australia, Australian Capital Territory",+61 2 6243 4211,socialmedia@awm.gov.au,2025-04-08 13:01:58
989010239940890,https://www.facebook.com/989010239940890,AWMemorial,2025-01-18 00:00:59,2025-01-18,1737158459,68,1,3,"Are you sticking to your New Year’s resolution?

Many of us set fitness goals at the start of the year, and the crew of HMAS Adelaide in the early 1990s were no different.

Check out these images taken en route to the Persian Gulf, showing how the crew of HMAS Adelaide stayed fit during their service abroad.

Over 1,800 Australian Defence personnel served in the Gulf War from August 1990 to September 1991, as part of a 40,000 strong coalition force. 

Photographer: Jack Picone
Accession numbers: P11136.017 & P11136.021",,User,Australian War Memorial,100064957681170,62,1,3,1,1,0,0,AWMemorial,· Museum,"Fairbairn Avenue, Canberra, ACT, Australia, Australian Capital Territory",+61 2 6243 4211,socialmedia@awm.gov.au,2025-04-08 13:01:58
988304593344788,https://www.facebook.com/988304593344788,AWMemorial,2025-01-16 22:00:37,2025-01-16,1737064837,95,2,10,"This stuffed toy of ‘Felix the Cat’ was the unofficial mascot of the Gun Plot Room of HMAS Brisbane (II), after the Brisbane’s nickname ‘the Steel Cat’. The toy cat was usually kept by the work stations of the crew in the Gun Plot Room, until it was decommissioned in 2001.

The character of ‘Felix the Cat’ was created in 1919 by Australian cartoonist Pat Sullivan and American animator Otto Messmer. Felix has remained a popular character since his creation, including as a mascot for various military units.

On 17 January 1991, HMAS Brisbane (II) and HMAS Sydney (IV) were stationed in the Persian Gulf witnessing the start of Operation Desert Storm.

Operation Desert Storm was the 42 day combat phase of the Gulf War, fought between the military forces of Iraqi dictator Saddam Hussein and a coalition force from 35 nations led by the United States.

Accession number: REL32980.022

Image: Port Bow view of HMAS Brisbane at the dock, 8 January 1991. Photographer: J Hamilton. AWM P01572.001

#objectoftheweek #AWMobjects #myawm #AWMemorial",,User,Australian War Memorial,100064957681170,86,0,7,1,1,0,0,AWMemorial,· Museum,"Fairbairn Avenue, Canberra, ACT, Australia, Australian Capital Territory",+61 2 6243 4211,socialmedia@awm.gov.au,2025-04-08 13:01:58
987709036737677,https://www.facebook.com/987709036737677,AWMemorial,2025-01-16 01:01:53,2025-01-16,1736989313,55,0,2,"Krista Vane-Tempest has been sharing her knowledge and passion with visitors as an Memorial Voluntary Guide for over 14 years.

Now, the Memorial is calling on those who share Krista's passion for the Memorial's collection to consider becoming a Volunteer Guide.

Learn more: https://brnw.ch/21wQ2fs",1114.0,User,Australian War Memorial,100064957681170,48,0,6,1,0,0,0,AWMemorial,· Museum,"Fairbairn Avenue, Canberra, ACT, Australia, Australian Capital Territory",+61 2 6243 4211,socialmedia@awm.gov.au,2025-04-08 13:01:58
986914496817131,https://www.facebook.com/986914496817131,AWMemorial,2025-01-14 23:00:11,2025-01-14,1736895611,74,0,10,"In 1919, official war historian and Memorial founder Charles Bean sketched a design for the building he envisioned would become the Australian War Memorial. In 2020, that design was digitally re-created for the first time. ✍🏼✨

During the First World War, artists and photographers were deployed to the front to witness and record the war first hand. Art of Nation is a digital experience that lets you explore Australia's official war art and photography collection as Bean had intended, in the space he designed.

Explore Art of Nation: https://www.awm.gov.au/visit/exhibitions/art-of-nation

---
Image: Charles Bean’s 1919 sketch of his proposal for the Memorial. AWM170 1/1",,User,Australian War Memorial,100064957681170,73,0,1,0,0,0,0,AWMemorial,· Museum,"Fairbairn Avenue, Canberra, ACT, Australia, Australian Capital Territory",+61 2 6243 4211,socialmedia@awm.gov.au,2025-04-08 13:01:58
986215093553738,https://www.facebook.com/986215093553738,AWMemorial,2025-01-13 23:00:13,2025-01-13,1736809213,445,49,46,"Giant clam shells in the Solomon Islands. Australian artist eX de Medici took hundreds of reference photos whilst deployed as an official AWM artist during the RAMSI peacekeeping mission.

Her deployment occurred during one of the wettest weeks of the year, leaving her unable to paint or sketch in situ. Giant clams are a threatened species due to overharvesting. 

Accession Number: P11527.072
Photographer: AWM Official Artist eX de Medici

#photooftheweek #myawm #solomonislands #conservation #threatenedspecies",,User,Australian War Memorial,100064957681170,223,0,11,7,76,116,12,AWMemorial,· Museum,"Fairbairn Avenue, Canberra, ACT, Australia, Australian Capital Territory",+61 2 6243 4211,socialmedia@awm.gov.au,2025-04-08 13:01:58
985689350272979,https://www.facebook.com/985689350272979,AWMemorial,2025-01-13 05:00:09,2025-01-13,1736744409,108,0,14,"Saigon, Vietnam. June 1971. A young Vietnamese boy keeps his distance from a large elephant at the Saigon Zoo, as would any child, seeing them for the first time.

The boy, an orphan from St Elizabeth's Orphange in Saigon, was obviously quite content to let Warrant Officer Class 2 Ron Cox of Ingleburn, NSW, do the feeding.

The outing was organised by RAAF and Army senior non-commissioned officers based in Saigon.

Photographer: William James Cunneen
Accession number: CUN/71/0287/VN",,User,Australian War Memorial,100064957681170,90,0,3,14,0,1,0,AWMemorial,· Museum,"Fairbairn Avenue, Canberra, ACT, Australia, Australian Capital Territory",+61 2 6243 4211,socialmedia@awm.gov.au,2025-04-08 13:01:58
984969340344980,https://www.facebook.com/984969340344980,AWMemorial,2025-01-12 03:00:07,2025-01-12,1736650807,393,28,10,"A heartwarming Christmas moment from 1967. 🎄🎉

On 25 December 1967, the 222nd Aviation Battalion put on a Christmas party for 88 orphans of the Bethanane Institute in Vung Tau, South Vietnam.

In this image, Leading Airman Photographer John Dawe spends time with some of the children while they are enjoying a meal. The children put on a show for the servicemen which included singing, marching and dancing.

Santa Claus arrived at the party by helicopter, with each child receiving a present of clothes, and a Christmas stocking supplied by an Officers' Wives Club in Missoula, Montana, USA.

Accession number: NAVY15091",,User,Australian War Memorial,100064957681170,308,0,26,58,0,1,0,AWMemorial,· Museum,"Fairbairn Avenue, Canberra, ACT, Australia, Australian Capital Territory",+61 2 6243 4211,socialmedia@awm.gov.au,2025-04-08 13:01:58
984245140417400,https://www.facebook.com/984245140417400,AWMemorial,2025-01-11 01:01:20,2025-01-11,1736557280,225,1,25,"Watch the Memorial’s Digitised Collections team digitise this map of Paris from the Sir John Monash collection (3DRL/2316.258). 🗺️🔍

Using our state-of-the-art METIS scanner we are able to capture images of up to 2 metres wide with fine detail, ensuring these precious documents are preserved and made accessible into the future. 

Now that this map has been digitised, it will soon be added to our online collections. ✨

Read more about this item and the digitisation process: https://brnw.ch/21wPVqV",5941.0,User,Australian War Memorial,100064957681170,199,0,14,6,6,0,0,AWMemorial,· Museum,"Fairbairn Avenue, Canberra, ACT, Australia, Australian Capital Territory",+61 2 6243 4211,socialmedia@awm.gov.au,2025-04-08 13:01:58
983508910491023,https://www.facebook.com/983508910491023,AWMemorial,2025-01-09 22:03:39,2025-01-09,1736460219,118,4,12,"Can you imagine being presented with a scarf handmade by Queen Victoria?

Watch to find out how Australian 2nd Lieutenant Alfred Du Frayer earned this coveted gift.

Accession number: OL00429.001

#ObjectOfTheWeek",1665.0,User,Australian War Memorial,100064957681170,102,0,7,4,5,0,0,AWMemorial,· Museum,"Fairbairn Avenue, Canberra, ACT, Australia, Australian Capital Territory",+61 2 6243 4211,socialmedia@awm.gov.au,2025-04-08 13:01:58
982935377215043,https://www.facebook.com/982935377215043,AWMemorial,2025-01-09 01:00:08,2025-01-09,1736384408,116,3,15,"In January 1940, 85 years ago, the Australian Comforts Fund (ACF) was re-established.

The ACF, based on its First World War predecessor, raised money for comfort parcels for Australian service personnel in the field, clothing and the provision of meals and accommodation for men on leave.

By the close of operations at the end of the Second World War the ACF had delivered more than 1,500,000 Christmas hampers.

Images: Tel Aviv, 3 June 1940. Comforts Fund tearooms, where free cups of tea and biscuits were given to each man.

Photographer: Damien Peter Parer",,User,Australian War Memorial,100064957681170,95,0,10,10,1,0,0,AWMemorial,· Museum,"Fairbairn Avenue, Canberra, ACT, Australia, Australian Capital Territory",+61 2 6243 4211,socialmedia@awm.gov.au,2025-04-08 13:01:58
