post_id,post_url,username_or_userid,timestamp,date,time,total_reactions,total_comments,total_shares,post_text,video_view_count,profile_type,profile_name,profile_id,reaction_Like,reaction_Haha,reaction_Love,reaction_Care,reaction_Wow,reaction_Sad,reaction_Angry,account_name,account_type,account_category,account_website,account_followers,scrape_date
965026499005931,https://www.facebook.com/965026499005931,AWMemorial,2024-12-13 04:00:22,2024-12-13,1734062422,88,1,5,"These two pieces of bronze show us what the Memorial’s Roll of Honour might have looked like. They were produced to display different styles available. One is plain, the other textured. 

Ultimately neither of these two exact styles were selected for the Roll of Honour when the panels began to be installed in 1961. 

What is interesting about these two sample panels is that the names are listed under a town, rather than unit as is on the Roll of Honour today. Charles Bean’s initial concept for the Roll of Honour was to list the names of the fallen under the town they were best associated with, as that would be more familiar to family and friends than their unit. 

Identifying a town of association proved too difficult for everyone on the roll, so in 1954 it was decided that names were to be listed under the individual’s last unit, in alphabetical order, and without rank or decoration.

Accession numbers: REL34130 (Textured example) & REL34131 (Plain example).

Images: The Memorial prior to the installation of the panels. John Lee, 1945. AWM 08570; The Roll of Honour as it was produced. AWM2018.4.230.2

#objectoftheweek",,User,Australian War Memorial,100064957681170,76,0,0,12,0,0,0,AWMemorial,· Museum,"Fairbairn Avenue, Canberra, ACT, Australia, Australian Capital Territory",+61 2 6243 4211,socialmedia@awm.gov.au,2025-04-08 13:01:58
964876479020933,https://www.facebook.com/964876479020933,AWMemorial,2024-12-12 22:00:24,2024-12-12,1734040824,299,20,29,"On this day 60 years ago, HMAS Teal encountered two vessels a mile off Raffles Light near Singapore. The two vessels separated and one escaped into Indonesian waters; the other opened fire... ⚓

During the Indonesian Confrontation, as part of the Commonwealth’s commitment to safeguard Malaysia’s independence, the Royal Australian Navy was involved in surveillance in the waters surrounding Malacca and Singapore.

The Ton-class minesweeper HMAS Teal was tasked with patrol duties in the Singaporean Straits, from 1964 to early 1966. Its crew of three officers and thirty ratings operated under the command of Lieutenant Commander Keith ‘Gus’ Murray.

On 6 December 1964, HMAS Teal intercepted a vessel attempting evasion, which was found to be carrying suspected Indonesian infiltrators. One week later, on 13 December, the crew engaged two unlit vessels. When one craft was approached and spotlighted, it opened fire.

Responding swiftly, HMAS Teal returned fire until the vessel surrendered; from the encounter, several men were killed and others wounded. The captured craft was searched, explosives and ammunition seized, and its crew arrested and handed over to Singaporean Police.

Wireless communications allowed minute-accurate, emergency correspondence to be transmitted between HMAS Teal and other RAN, British and Malaysian vessels. This collection of signals to and from HMAS Teal detail the series of engagements as they escalated and were responded to under Murray’s command across 1964 and 1965. Several signals sent back to HMAS Teal by RAN, British and Malayan naval counterparts congratulate Murray and his crew on their actions.

For his judgement and diligence in upholding naval security as HMAS Teal’s commanding officer, Murray was awarded a Distinguished Service Cross – the only RAN officer to receive this honour during the Indonesian Confrontation.

Images: Portrait of Lieutenant Keith Murray. NAVY08695",,User,Australian War Memorial,100064957681170,242,0,19,36,0,2,0,AWMemorial,· Museum,"Fairbairn Avenue, Canberra, ACT, Australia, Australian Capital Territory",+61 2 6243 4211,socialmedia@awm.gov.au,2025-04-08 13:01:58
964199909088590,https://www.facebook.com/964199909088590,AWMemorial,2024-12-11 22:00:23,2024-12-11,1733954423,331,8,14,"A match made in Vietnam. 💍

Sergeant Allen Clement and Staff Sergeant Christine Matthews met while they were both working at the U.S. Army base at Long Binh.

Originally from Greenacre in Sydney, Sergeant Clement was serving as the Australian Army's Ordnance Corps liaison NCO at the base when he met Staff Sergeant Matthews, who was from Chicago, Illinois.

Their love blossomed, culminating in the pair marrying in a unique ceremony at Saigon, in March 1970. It was the first time in the Vietnam war that an Australian soldier married an American servicewoman.

---

Images: 

1. Sergeant Allen Clement places the wedding ring onto Staff Sergeant Christine Matthews finger. WAR/70/0166/VN

2. Sergeant Allen Clement and Staff Sergeant Christine Matthews share a toast with Australian Army friends at their wedding reception. WAR/70/0167/VN

Photographer: Peter Anthony Ward",,User,Australian War Memorial,100064957681170,266,0,53,10,2,0,0,AWMemorial,· Museum,"Fairbairn Avenue, Canberra, ACT, Australia, Australian Capital Territory",+61 2 6243 4211,socialmedia@awm.gov.au,2025-04-08 13:01:58
963755449133036,https://www.facebook.com/963755449133036,AWMemorial,2024-12-11 04:02:37,2024-12-11,1733889757,60,2,6,"Drawn just one month before her death, this portrait of Sister Marie Craig by official war artist Nora Heysen reflects the perilous reality of service during the Second World War.

Watch 'Nora Heysen's War: Women, War, and Work' on our YouTube channel: https://brnw.ch/21wPkAa",881.0,User,Australian War Memorial,100064957681170,39,0,4,15,0,2,0,AWMemorial,· Museum,"Fairbairn Avenue, Canberra, ACT, Australia, Australian Capital Territory",+61 2 6243 4211,socialmedia@awm.gov.au,2025-04-08 13:01:58
962990242542890,https://www.facebook.com/962990242542890,AWMemorial,2024-12-09 22:02:00,2024-12-09,1733781720,264,7,14,"Group photograph of servicewomen in Japan, including Corporal Alva Marie Bennetts, 130th Australian General Hospital.

Caption on reverse reads: ""From left: Alva, Edna, and Frances. Taken in Kure, Japan, November '47"".

Accession number: AWM2019.134.2

#photooftheweek",,User,Australian War Memorial,100064957681170,206,0,15,43,0,0,0,AWMemorial,· Museum,"Fairbairn Avenue, Canberra, ACT, Australia, Australian Capital Territory",+61 2 6243 4211,socialmedia@awm.gov.au,2025-04-08 13:01:58
962353162606598,https://www.facebook.com/962353162606598,AWMemorial,2024-12-08 22:05:24,2024-12-08,1733695524,173,12,10,"""The opposite of losing.""

In August 1942, the furthermost outpost in New Guinea was in the command of Scotsman Captain Winning.

When Damien Peter Parer took this photo, he inquired about the name of his subject. With typical Scottish humour, Winning replied ""The opposite of losing.""

Image: Portrait of Captain Winning, 29 August 1942. Photographer: Damien Peter Parer. AWM 013160",,User,Australian War Memorial,100064957681170,146,0,6,20,0,1,0,AWMemorial,· Museum,"Fairbairn Avenue, Canberra, ACT, Australia, Australian Capital Territory",+61 2 6243 4211,socialmedia@awm.gov.au,2025-04-08 13:01:58
961713352670579,https://www.facebook.com/961713352670579,AWMemorial,2024-12-08 00:00:54,2024-12-08,1733616054,202,7,12,"Hats off to this great photo! 🎩

Australian aviators, each wearing a different kind of head gear pose with their mascot, a dog named Spaghetti, in Sicily, Italy. 

Spaghetti was adopted by the famous ""Desert Harassers"", No. 450 (Kittyhawk) Squadron RAAF during the campaign in Tripoli, 1943. 

Left to right: Back row: Leading Aircraftman (LAC) Bourdett of NSW; LAC Asser of NSW; Corporal Little of NSW. Front row: LAC Muldron of NSW; LAC McIlven of Qld, and Sergeant Archer of Vic.   Laurence Craddock Le Guay, MEA0501",,User,Australian War Memorial,100064957681170,164,0,26,12,0,0,0,AWMemorial,· Museum,"Fairbairn Avenue, Canberra, ACT, Australia, Australian Capital Territory",+61 2 6243 4211,socialmedia@awm.gov.au,2025-04-08 13:01:58
960946622747252,https://www.facebook.com/960946622747252,AWMemorial,2024-12-06 20:02:02,2024-12-06,1733515322,153,11,36,"On this day in 1941, the Empire of Japan launched a surprise attack on the United States of America.

Just after dawn on 7 December 1941, Japanese planes launched from aircraft carriers struck the island of Oahu, Hawaii. Their primary target was the US Navy’s Pacific Fleet at Pearl Harbor.

In less than two hours they wrought havoc. As the Japanese pilots winged their way back to their carriers, behind them the harbour was ablaze and thick palls of smoke rose from numerous stricken ships.

Chaos reigned as survivors worked frantically to save those trapped inside ships, or to help the wounded. Shock and disbelief soon gave way to anger and resolve to strike back.

With this audacious attack, both nations now entered the Second World War, making it a truly global conflict.

---
Images: Japanese plane being salvaged from the waters of Pearl Harbour, 20 March 1942. AWM 011749; The attack on Pearl Harbour, 7 December 1941. AWM 043822 & AWM 106588.",,User,Australian War Memorial,100064957681170,85,0,2,31,3,30,2,AWMemorial,· Museum,"Fairbairn Avenue, Canberra, ACT, Australia, Australian Capital Territory",+61 2 6243 4211,socialmedia@awm.gov.au,2025-04-08 13:01:58
960325109476070,https://www.facebook.com/960325109476070,AWMemorial,2024-12-05 22:01:55,2024-12-05,1733436115,120,2,8,"Flying Officer Desmond Sheen was wounded in the ear and thigh during an air operation on 7 December 1939.

Flying Spitfires with No. 72 Squadron, RAF, Sheen engaged a formation of seven German Heinkel He111 bombers off the coast of Scotland. This ear cover was part of the ‘Type B’ flying helmet he was wearing that day.

It has been pierced either side of the zipper, with one of the tears significantly larger than the other, indicating the bullet’s likely point of exit.

Sheen joined the RAAF in 1936 before travelling to England on a short term RAF commission. He was one of a small number of Australians who served with Fighter Command in 1940 during the Battle of Britain.

Accession number: REL/10348

Image: Flying Officer Desmond Sheen receiving DFC from King George VI, 1940. AWM 044858

#objectoftheweek",,User,Australian War Memorial,100064957681170,90,0,3,19,8,0,0,AWMemorial,· Museum,"Fairbairn Avenue, Canberra, ACT, Australia, Australian Capital Territory",+61 2 6243 4211,socialmedia@awm.gov.au,2025-04-08 13:01:58
959826149525966,https://www.facebook.com/959826149525966,AWMemorial,2024-12-05 04:01:01,2024-12-05,1733371261,132,5,7,"Flying Officer Henry Oscar Mason was a Radio Announcer for 2GB Sydney before he enlisted as a RAAF wireless operator on 5 December 1942. 

By the end of 1944, Flying Officer Mason was taking part in a covert aerial operation with the British Special Operations Executive (SOE).

Throughout the Second World War, Allied forced secretly dropped supplies and provided aerial support to Yugoslavian partisans waging guerilla campaigns against Axis occupation. 

On 26 January 1945, FO Mason was the air gunner on one of these supply trips, bound for a drop point codenamed 'Icarus, Minimus' in North Yugoslavia. All 8 men in the crew of Halifax JP281 from 148 Squadron were killed when the aircraft crashed on Mount Kamesnica, located near the Croatian border.

In a letter to his wife, FO Mason's Squadron Leader described him as someone who ""could always be relied upon to carry out his duties to the utmost of his abilities"", whose loss was ""a severe blow"". 

---
Images:
Informal portrait of 432241 Flying Officer Oscar Mason, Celone Italy c 1944, Laurence Craddock Le Guay, MEC1779

Group portrait of RAAF crew members of No. 614 (Halifax) Squadron RAF. Left to right: 410964 Flying Officer R. Eisenhauer, 420073 FO H. Walker; 432179 Flight Sergeant W. Hodgins; 422056 WO V. Murphy; 424009 WO L. Shannon; 432241 FO H.O. Mason. Celone, Italy. c. 1944, Laurence Craddock Le Guay, MEC1774",,User,Australian War Memorial,100064957681170,92,0,0,18,0,22,0,AWMemorial,· Museum,"Fairbairn Avenue, Canberra, ACT, Australia, Australian Capital Territory",+61 2 6243 4211,socialmedia@awm.gov.au,2025-04-08 13:01:58
959688476206400,https://www.facebook.com/959688476206400,AWMemorial,2024-12-04 22:00:21,2024-12-04,1733349621,196,11,7,"Today we are celebrating the Memorial's volunteers with our annual Volunteer Awards Night.

Meet long-term Voluntary Guide Patrick Moore.

He moves quickly for a man about to clock up his 85th birthday, particularly so when taking into account his two knees aren’t original parts.

For visitors lucky enough to go on a tour with him, it doesn’t take long to learn that Patrick’s legs aren’t the only thing still moving at full pace.

“My doctor keeps telling me working as a guide is good for my health, both physical and mental,” Patrick said. “I must say to this point, he appears to be right.”

Now, in his 18th year as a guide at the Memorial, Patrick is still looking for ways to improve the guided experience. 

Read the full story in the 2023-2024 Year in Review: https://brnw.ch/21wOluX",,User,Australian War Memorial,100064957681170,150,0,39,6,1,0,0,AWMemorial,· Museum,"Fairbairn Avenue, Canberra, ACT, Australia, Australian Capital Territory",+61 2 6243 4211,socialmedia@awm.gov.au,2025-04-08 13:01:58
959107776264470,https://www.facebook.com/959107776264470,AWMemorial,2024-12-04 01:02:51,2024-12-04,1733274171,58,4,1,"Did you know that some Australian servicemen volunteered to be infected with malaria during the Second World War? 

While stationed near Cairns at the Land Headquarters Medical Research Unit, official war artist Nora Heysen painted this poignant scene in which Private Hazel Lugge sponges down one of these hospitalised volunteers.

Watch the full documentary: https://brnw.ch/21wPaK8",999.0,User,Australian War Memorial,100064957681170,35,0,1,15,7,0,0,AWMemorial,· Museum,"Fairbairn Avenue, Canberra, ACT, Australia, Australian Capital Territory",+61 2 6243 4211,socialmedia@awm.gov.au,2025-04-08 13:01:58
958522579656323,https://www.facebook.com/958522579656323,AWMemorial,2024-12-03 04:00:10,2024-12-03,1733198410,3015,98,157,"The 'Fab 4' Nurses from the 8th Field Ambulance.

Lieutenant (Lt) Margaret Ahern, Captain Amy Pittendreigh, Lt Colleen Mealy (F45062), and Lieutenant Terrie Roche (F25126) watch with cameras in hand as the 2nd Battalion, Royal Australian Regiment, commences a Heliborne assault in Phuoc Tuy Province, Vietnam, 1967.

Accession number: P04669.974

Photographer: Dennis Stanley Gibbons

#photooftheweek",,User,Australian War Memorial,100064957681170,2578,2,114,305,14,2,0,AWMemorial,· Museum,"Fairbairn Avenue, Canberra, ACT, Australia, Australian Capital Territory",+61 2 6243 4211,socialmedia@awm.gov.au,2025-04-08 13:01:58
957682336407014,https://www.facebook.com/957682336407014,AWMemorial,2024-12-01 22:00:40,2024-12-01,1733090440,282,6,16,"Can you imagine the joy in this photo? ♥️👪

80 years ago in November 1944, this photograph was taken of Leading Writer Kenneth Edwin Fuller being reunited with his wife and son Robert, at No. 5 Wharf Circular Quay with the arrival of wounded men from HMAS Australia.

Many of the men had been badly wounded during a Japanese kamikaze attack at Leyte Gulf in October 1944.

Accession number: AWM 082905",,User,Australian War Memorial,100064957681170,196,0,27,59,0,0,0,AWMemorial,· Museum,"Fairbairn Avenue, Canberra, ACT, Australia, Australian Capital Territory",+61 2 6243 4211,socialmedia@awm.gov.au,2025-04-08 13:01:58
956974563144458,https://www.facebook.com/956974563144458,AWMemorial,2024-11-30 21:01:10,2024-11-30,1733000470,116,0,12,"In this photograph, three members of the RAAF serving with No. 150 Squadron RAF are seen reading a letter from the Prime Minister of Australia.

In December 1943, the squadron was experiencing typical Italian winter weather of snow, cold and rain, when one of the Australian airmen jokingly sent the Prime Minister a Christmas card.

It read: ""Merry Xmas. Wish you were here with us in Italy"".

The men are reacting to the reply they received, which was written in a typically bureaucratic style. 

---

Left to right: Flight Sergeant John 'Legs' Daly; Flight Sergeant Doug 'Yip' Chapman, and Flying Officer Ron 'Jo' Turner. Accession number: SUK14801",,User,Australian War Memorial,100064957681170,104,0,9,3,0,0,0,AWMemorial,· Museum,"Fairbairn Avenue, Canberra, ACT, Australia, Australian Capital Territory",+61 2 6243 4211,socialmedia@awm.gov.au,2025-04-08 13:01:58
956377756537472,https://www.facebook.com/956377756537472,AWMemorial,2024-11-30 00:00:15,2024-11-30,1732924815,177,8,5,"Donna Dixon never met her uncle, Ken, or great-grand uncle, Peter. But both men hold a special place in her heart.

Trooper Kenneth Goodliffe was 22 years old when he was killed in action near Aitape in New Guinea in December 1944 during the Second World War.

Nearly 28 years earlier during the First World War, Private Peter Maclean was killed in action fighting on the Somme in April 1917.

His brother Roderick spent all of that night searching field hospitals and casualty clearing stations, hoping to find his missing brother. He never did.

Today and tomorrow, Donna and her family will commemorate the two men in separate Last Post Ceremonies at the Australian War Memorial.

Read the full story: https://brnw.ch/21wP5qg

---

Images:

1. Donna visiting Peter's name on the Australian National Memorial at Villers-Bretonneux in April 2024.

2. Private Peter Maclean with his nieces Ina and Jean on leave in Scotland in late 1916.

3. Ken Goodliffe (left) posing in uniform for a photo with his family. Donna's father Donald is in the middle of the back row.",,User,Australian War Memorial,100064957681170,105,0,7,50,0,15,0,AWMemorial,· Museum,"Fairbairn Avenue, Canberra, ACT, Australia, Australian Capital Territory",+61 2 6243 4211,socialmedia@awm.gov.au,2025-04-08 13:01:58
955805189928062,https://www.facebook.com/955805189928062,AWMemorial,2024-11-29 04:00:18,2024-11-29,1732852818,63,1,1,"This ship’s telescope looks small in the image, but is actually over a metre long. Twisting the cylinder focuses and enlarges objects being viewed, extending the telescopes a further 19 centimetres.

Made from brass covered with leather by Thomas Gaunt, a successful jeweller, clockmaker, and scientific instrument manufacturer, the telescope dates to the mid-19th century.

Inscribed on the side of the brass draw tube is ‘HMCS Victoria T. Gaunt Optician, Sydney & Melbourne.’, connecting this telescope with naval officers on the HMCS Victoria, Australia’s first warship.

When the Colony of Victoria commissioned HMCS Victoria in 1854, it was the first warship ordered by an Australian colony. Fitted with both sails and a steam engine, it launched in England a year before arriving in Victoria on 31 May 1856 to serve the colony in scientific, police and military roles. 

When the First Taranaki War broke out in New Zealand in 1860, the Victoria sailed to New Zealand in support of its government. This was the first Australian unit committed to overseas service.

She carried 134 men from the 40th (2nd Somersetshire) Regiment of Foot. Once these troops were disembarked, the crew and vessel remained in New Zealand waters to support the colonial forces. 

This included action against the heavily fortified Maori pa (fort) at Matakoriko on 28 December 1860. Following the end of hostilities, the Victoria returned to Melbourne on 11 April 1861, concluding what is now seen as Australia’s earliest naval deployment.

Images: 
1. HMCS Victoria Telescope. Accession number: REL34389.001
2. HMCS Victoria in Port Melbourne, 1867. AWM 30060
3. View from Sandridge of the 'Victoria' and HMVS 'Nelson'. Artist Unknown, c. 1868. ART91193 

#objectoftheweek #AWMobjects #myawm #AWMemorial",,User,Australian War Memorial,100064957681170,57,0,1,0,5,0,0,AWMemorial,· Museum,"Fairbairn Avenue, Canberra, ACT, Australia, Australian Capital Territory",+61 2 6243 4211,socialmedia@awm.gov.au,2025-04-08 13:01:58
954994083342506,https://www.facebook.com/954994083342506,AWMemorial,2024-11-27 22:01:55,2024-11-27,1732744915,123,1,7,"Get ready to take to the stage, we’re going back to the 1960’s! 💃Curator Daniel Eisenberg and Textile Conservator Jessie Firth discuss the recent changeover for our touring exhibition.

See the iconic sparkling dress from “The Sapphires” up close and personal in our touring exhibition, ACTION! Film & War – now showing at the Jervis Bay Maritime Museum and Gallery.

📍 Where: Jervis Bay Maritime Museum and Gallery
📅 When: 1 November 2024 – 27 January 2025

Plan your visit today: https://brnw.ch/21wP243",5906.0,User,Australian War Memorial,100064957681170,103,0,18,0,2,0,0,AWMemorial,· Museum,"Fairbairn Avenue, Canberra, ACT, Australia, Australian Capital Territory",+61 2 6243 4211,socialmedia@awm.gov.au,2025-04-08 13:01:58
954349763406938,https://www.facebook.com/954349763406938,AWMemorial,2024-11-26 23:00:09,2024-11-26,1732662009,115,9,7,"Today is the 85th anniversary of the formation of the Empire Air Training Scheme (EATS). 

At the outbreak of the Second World War, EATS was established to train 50,000 new aircrew annually in order to maintain the Royal Air Force (RAF) during the impending war in Europe. Between November 1940 and March 1945 over 37,000 Australian airmen were trained as part of the scheme. 

Flight Sergeant Edward George Wicky of Manly (left) and his observer Flight Sergeant Oswald Mountford of Leeton were trained through the scheme. Together they completed the 1000th sortie flown since D-Day by No. 464 (Mosquito) Squadron RAAF, which was based at RAF Station Methwold. 

On February 3, 1945, their aircraft took part in a raid by 17 Mosquitoes on enemy targets behind the battle area in Europe. On returning from this mission, their aircraft crashed, and both airmen were killed in bad visibility near Horndean, UK. They are buried in Brookwood Military Cemetery in Surrey, UK. 

In today's Last Post Ceremony, we will pay tribute to Flt Sgt Oswald Mountford and remember the service of all those who were trained under the Empire Air Training Scheme.  

Photo: 422783 Flight Sergeant Edward George Wicky and his 422628 Flt Sgt Oswald Mountford, c October 1944, SUK13129",,User,Australian War Memorial,100064957681170,84,0,2,20,0,9,0,AWMemorial,· Museum,"Fairbairn Avenue, Canberra, ACT, Australia, Australian Capital Territory",+61 2 6243 4211,socialmedia@awm.gov.au,2025-04-08 13:01:58
954328236742424,https://www.facebook.com/954328236742424,AWMemorial,2024-11-26 22:03:04,2024-11-26,1732658584,87,2,13,"As Australia's first female official war artist, Nora Heysen lead the way for future generations of war artists.

Curator of Art, Lara Nicholls, highlights the symbolism in Heysen's renowned portrait of Aircraftwoman Florence Miles, entitled 'Transport Driver', which is now back on display in the Second World War gallery.

Watch the full documentary: https://brnw.ch/21wP0gc",1226.0,User,Australian War Memorial,100064957681170,74,0,4,9,0,0,0,AWMemorial,· Museum,"Fairbairn Avenue, Canberra, ACT, Australia, Australian Capital Territory",+61 2 6243 4211,socialmedia@awm.gov.au,2025-04-08 13:01:58
953754163466498,https://www.facebook.com/953754163466498,AWMemorial,2024-11-26 02:00:10,2024-11-26,1732586410,113,2,16,"#OnThisDay in 1919, The last quota of the 1st Division Artillery left the town of Chatelineau in Belgium, to begin their journey home to Australia, as captured in this incredible image from 105 years ago, donated by R. A. Ayrton.

Image: Chatelineau, Belgium. 26 November 1919. The last quota of the 1st Division Artillery, AIF, leaving the town to entrain at Charleroi to begin their journey home. AWM H15345 (Donor R.A. Ayrton)",,User,Australian War Memorial,100064957681170,86,0,4,21,1,1,0,AWMemorial,· Museum,"Fairbairn Avenue, Canberra, ACT, Australia, Australian Capital Territory",+61 2 6243 4211,socialmedia@awm.gov.au,2025-04-08 13:01:58
952969523544962,https://www.facebook.com/952969523544962,AWMemorial,2024-11-24 22:00:10,2024-11-24,1732485610,209,3,16,"Melbourne, VIC. Private Jack Martin, driver of the Mobile Entertainment Unit purchased with money raised by the State School children of Victoria, shows children of the Rathdowne Street State School, Carlton, the workings of a loud speaker, 4 May 1943.

Accession number: AWM 138832",,User,Australian War Memorial,100064957681170,165,0,25,19,0,0,0,AWMemorial,· Museum,"Fairbairn Avenue, Canberra, ACT, Australia, Australian Capital Territory",+61 2 6243 4211,socialmedia@awm.gov.au,2025-04-08 13:01:58
